{
  "$comment": "App-compat contract: modern (model) label -> legacy Dialogflow app label. Clients read this at their engine output boundary and translate. 'confirm_compound' rebuilds dialogue-act labels (e.g. Cmd.SendMessage - yes/no) from a resolved confirmation outcome; those are NOT model labels. Generated by inverting language_packs/en/extras/sources/label_migration_map.json.",
  "generated_from": "language_packs/en/extras/sources/label_migration_map.json",
  "map": {
    "activity.aerobics.query": "Cmd.ActivityAerobics",
    "activity.calories.query": "Cmd.ActivityCalories",
    "activity.cycle.query": "Cmd.ActivityCycle",
    "activity.exercise.query": "Cmd.ActivityExercise",
    "activity.run.query": "Cmd.ActivityRun",
    "activity.stand.query": "Cmd.ActivityStand",
    "activity.step.query": "Cmd.ActivityStep",
    "activity.walk.query": "Cmd.ActivityWalk",
    "device.memory.change": "Cmd.MemoryChange",
    "device.status.battery": "Cmd.BatteryLevel",
    "device.volume.decrease": "Cmd.VolumeDecrease",
    "device.volume.increase": "Cmd.VolumeIncrease",
    "device.volume.mute": "Cmd.VolumeMute",
    "device.volume.unmute": "Cmd.VolumeUnmute",
    "find.phone.locate": "Cmd.FindMyPhone",
    "help.accessories.show": "Help_Accessories",
    "help.app_settings.show": "Help_AppSettings",
    "help.battery.show": "Help_Battery",
    "help.changing_memories.show": "Help_ChangingMemories",
    "help.clean_care.show": "Help_CleanCare",
    "help.customize.show": "Help_Customize",
    "help.demo_mode.show": "Help_DemoMode",
    "help.device_settings.show": "Help_DeviceSettings",
    "help.edge_mode.show": "Help_EdgeMode",
    "help.fall_alert.show": "Help_FallAlert",
    "help.find_my_hearing_aids.show": "Help_FindMyHearingAids",
    "help.health.show": "Help_Health",
    "help.hear_share.show": "Help_HearShare",
    "help.hearing_care_anywhere_connect.show": "Help_HearingCareAnywhereConnect",
    "help.heart_rate.show": "Help_HeartRate",
    "help.heart_rate_recovery.show": "Help_HeartRateRecovery",
    "help.home.show": "Help_Home",
    "help.insert_device.show": "Help_InsertDevice",
    "help.intelli_voice.show": "Help_IntelliVoice",
    "help.mask_mode.show": "Help_MaskMode",
    "help.memory_options.show": "Help_MemoryOptions",
    "help.pairing.show": "Help_Pairing",
    "help.reminder.show": "Help_Reminder",
    "help.remote_programming.show": "Help_RemoteProgramming",
    "help.self_check.show": "Help_SelfCheck",
    "help.thrive_score.show": "Help_ThriveScore",
    "help.tinnitus.show": "Help_Tinnitus",
    "help.transcribe.show": "Help_Transcribe",
    "help.translate.show": "Help_Translate",
    "help.voice_assistant.show": "Help_VoiceAssistant",
    "help.volume.show": "Help_Volume",
    "help.whats_new.show": "Help_WhatsNew",
    "help.wi_c_r_o_s.show": "Help_WiCROS",
    "messaging.message.listen": "Cmd.ListenMessage",
    "messaging.message.send": "Cmd.SendMessage",
    "reminders.task.complete": "reminders.complete",
    "reminders.task.create": "reminders.add",
    "streaming.session.start": "Cmd.StreamingStart",
    "streaming.session.stop": "Cmd.StreamingStop",
    "sys.oos.fallback": "Default Fallback Intent",
    "transcription.session.start": "Cmd.TranscribeStart",
    "translation.session.start": "Cmd.TranslationStart"
  },
  "confirm_compound": {
    "messaging.message.send": {
      "yes": "Cmd.SendMessage - yes",
      "no": "Cmd.SendMessage - no"
    }
  }
}
